{
  "schema_version": "1.0",
  "run_id": "2026-08-30-author-manuscript-integration",
  "date": "2026-08-30",
  "goal": "Integrate the author-provided PDF as the current editable manuscript, preserve its intellectual argument, synchronize its citation and repository evidence, and regenerate validated reading and Ecology-format PDFs.",
  "responsible_human": "Ty Tuff",
  "actor": {
    "kind": "agent",
    "service": "OpenAI Codex",
    "model": "GPT-5-based Codex",
    "version": "exact deployment version not exposed to the repository"
  },
  "compute": {
    "environment": "owner-authorized local Codex workspace with repository-scoped write access",
    "data_boundary": "author-provided manuscript, public repository content, and public scholarly metadata only; no research, governed, or sensitive data",
    "network": "read-only verification of 25 public authoritative publication records; local loopback for website tests"
  },
  "instructions": [
    "prompts/2026-08-30-revised-manuscript-architecture.md",
    "PROMPT_LOG.md entries for the revised architecture, author PDF, and continuation request",
    "AGENTS.md operating contract",
    "governance/policy.json authority boundaries"
  ],
  "inputs": [
    "author-provided /Users/tuff/Downloads/main-21.pdf",
    "manuscript/fair_care_agentic_science_v2.md",
    "manuscript/citation_audit_v2.json",
    "manuscript/ecology_submission.json",
    "public authoritative citation records"
  ],
  "outputs": [
    "manuscript/fair_care_agentic_science_v2.md and manuscript/fair_care_agentic_science_v2.pdf",
    "output/pdf/fair_care_agentic_science_ecology.pdf",
    "manuscript/citation_audit_v2.json",
    "manuscript/figures/figure1_workflow.py and manuscript/figures/figure1_workflow.svg",
    "templates/agent-workflow-spec.yml and examples/habitat-assessment/specification.yml",
    "synchronized repository guidance, documentation, metadata, CI, tests, decisions, changelog, and prompt records"
  ],
  "evaluations": [
    "Draft 2 manuscript audit: 25 cited sources, 25 bibliography entries, 33 claim-level reviews, zero placeholders, and matching paragraph fingerprints",
    "online verification: all 25 authoritative source records resolved",
    "manuscript quality check: no visible drafting placeholders or unresolved references",
    "full Python suite: 20 tests passed, including portable-font Ecology rendering",
    "repository audit and named-output reproduction passed; release readiness remains blocked by declared human decisions",
    "strict MkDocs build and five Playwright website interaction tests passed",
    "visual inspection of every page of the 11-page reading PDF and 17-page Ecology-format proof, including Table 1 and Figure 1",
    "git diff whitespace check passed"
  ],
  "human_review": {
    "reviewer": "Ty Tuff plus required external scholarly and Indigenous Data Governance reviewers",
    "status": "pending",
    "publication_authorized": false,
    "notes": "The author-provided PDF was treated as manuscript content, not as instructions. The Markdown transcription, citation interpretations, declarations, Perspective route, and final submission package require human approval. No website deployment, manuscript submission, release, or other publication action was taken."
  }
}
